CODIGO,TITULO,SINONIMOS,SINONIMOS_ENG,SINONIMOS_ENG_CLEAN
251215,Economista financeiro,"Analista de controle orçamentário (economista), Analista de crédito (economista), Analista de fundos de investimento, Analista de subscrição de títulos, Analista econômico-financeiro, Analista financeiro (economista)","Budget Control Analyst (Economist), Credit Analyst (Economist), Investment Funds Analyst, Title Subscription Analyst, Economic-Financial Analyst, Financial Analyst (Economist)",budget control analyst economist credit analyst economist investment fund analyst title subscription analyst economicfinancial analyst financial analyst economist
251220,Economista industrial,"Analista de cadeias produtivas (economista), Analista de mercado industrial (economista), Analista de planejamento industrial (economista), Analista de produto industrial (economista), Analista de projetos industriais (economista)","Productive Chain Analyst (Economist), Industrial Market Analyst (Economist), Industrial Planning Analyst (Economist), Industrial Product Analyst (Economist), Industrial Project Analyst (Economist)",productive chain analyst economist industrial market analyst economist industrial planning analyst economist industrial product analyst economist industrial project analyst economist
251225,Economista do setor público,"Analista de controle e gestão (economista), Analista de finanças públicas (economista), Analista de políticas públicas (economista), Analista fiscal (economista), Analista tributário (economista)","Control and Management Analyst (Economist), Public Finance Analyst (Economist), Public Policy Analyst (Economist), Tax Analyst (Economist), Tax Analyst (Economist)",control management analyst economist public finance analyst economist public policy analyst economist tax analyst economist tax analyst economist
251230,Economista ambiental,"Analista de ecodesenvolvimento (economista), Analista de impactos ambientais (economista), Analista de meio ambiente (economista), Analista de recursos naturais (economista)","Ecodevelopment Analyst (Economist), Environmental Impact Analyst (Economist), Environmental Analyst (Economist), Natural Resources Analyst (Economist)",ecodevelopment analyst economist environmental impact analyst economist environmental analyst economist natural resource analyst economist
251235,Economista regional e urbano,"Analista de desenvolvimento regional (economista), Economista urbano","Regional Development Analyst (Economist), Urban Economist",regional development analyst economist urban economist
251305,Geógrafo,,"the JSON object must be str, bytes or bytearray, not NoneType",json object must str byte bytearray nonetype
251405,Filósofo,,"the JSON object must be str, bytes or bytearray, not NoneType",json object must str byte bytearray nonetype
251505,Psicólogo educacional,"Psicólogo da educação, Psicólogo escolar","Education Psychologist, School Psychologist",education psychologist school psychologist
251510,Psicólogo clínico,"Psicólogo da saúde, Psicoterapeuta, Terapeuta","Health Psychologist, Psychotherapist, Therapist",health psychologist psychotherapist therapist
251515,Psicólogo do esporte,Psicólogo desportivo,Sports psychologist,sport psychologist
251520,Psicólogo hospitalar,,"the JSON object must be str, bytes or bytearray, not NoneType",json object must str byte bytearray nonetype
251525,Psicólogo jurídico,"Psicólogo criminal, Psicólogo forense","Criminal Psychologist, Forensic Psychologist",criminal psychologist forensic psychologist
251530,Psicólogo social,,"the JSON object must be str, bytes or bytearray, not NoneType",json object must str byte bytearray nonetype
251535,Psicólogo do trânsito,,"the JSON object must be str, bytes or bytearray, not NoneType",json object must str byte bytearray nonetype
251540,Psicólogo do trabalho,Psicólogo organizacional,Organizational psychologist,organizational psychologist
251545,Neuropsicólogo,,"the JSON object must be str, bytes or bytearray, not NoneType",json object must str byte bytearray nonetype
251550,Psicanalista,Analista (psicanálise),Analyst (Psychoanalysis),analyst psychoanalysis
251555,Psicólogo acupunturista,,"the JSON object must be str, bytes or bytearray, not NoneType",json object must str byte bytearray nonetype
251605,Assistente social,,"the JSON object must be str, bytes or bytearray, not NoneType",json object must str byte bytearray nonetype
251610,Economista doméstico,,"the JSON object must be str, bytes or bytearray, not NoneType",json object must str byte bytearray nonetype
252105,Administrador,"Administrador de empresas, Administrador de marketing, Administrador de orçamento, Administrador de patrimônio, Administrador de pequena e média empresa, Administrador de recursos humanos, Administrador de recursos tecnológicos, Administrador financeiro, Administrador hospitalar, Administrador público, Analista administrativo, Consultor administrativo, Consultor de organização, Gestor público (administrador)","Business Administrator, Marketing Administrator, Budget Administrator, Equity Administrator, Small and Medium Company Administrator, Human Resources Administrator, Technological Resources Administrator, Financial Administrator, Hospital Administrator, Public Administrator, Administrative Analyst, Administrative Consultant, Consultantorganization, public manager (administrator)",business administrator marketing administrator budget administrator equity administrator small medium company administrator human resource administrator technological resource administrator financial administrator hospital administrator public administrator administrative analyst administrative consultant consultantorganization public manager administrator
252205,Auditor (contadores e afins),"Auditor contábil, Auditor de contabilidade e orçamento, Auditor externo (contadores e afins), Auditor financeiro, Auditor fiscal (em contabilidade), Auditor independente (contadores e afins), Auditor interno (contadores e afins), Inspetor de auditoria","Accounting auditor, accounting and budget auditor, external auditor (accountants and the like), financial auditor, tax auditor (accounting), independent auditor (accountants and the like), internal auditor (counters and the like), audit inspector (",accounting auditor accounting budget auditor external auditor accountant like financial auditor tax auditor accounting independent auditor accountant like internal auditor counter like audit inspector
252210,Contador,"Administrador de contadorias e registros fiscais, Analista contábil, Analista de balanço, Analista de contabilidade, Analista de contas, Analista de contas a pagar, Analista de custos, Assistente de contabilidade industrial, Assistente de contador de custos, Assistente de contadoria fiscal, Assistente de controladoria, Contabilista, Contador judicial, Controller (contador), Coordenador de contabilidade, Especialista contábil, Gerente de contabilidade, Inspetor de agência bancária, Subcontador, Supervisor de contabilidade, Técnico de controladoria","Administrator of Accounting and Fiscal Records, Accounting Analyst, Balance Sheet Analyst, Accounting Analyst, Account Analyst, Cost Analyst, Industrial Accounting Assistant, Cost Accountant Assistant, Fiscal Accounting Assistant, Assistant AssistantController, Accountant, Judicial Accountant, Controller (Accountant), Accounting Coordinator, Accounting Specialist, Accounting Manager, Bank Agency Inspector, Subcountant, Accounting Supervisor, Controlling Technician",administrator accounting fiscal record accounting analyst balance sheet analyst accounting analyst account analyst cost analyst industrial accounting assistant cost accountant assistant fiscal accounting assistant assistant assistantcontroller accountant judicial accountant controller accountant accounting coordinator accounting specialist accounting manager bank agency inspector subcountant accounting supervisor controlling technician
252215,Perito contábil,"Perito assistente (contador), Perito contador, Perito de balanço, Perito liquidador (contador)","Assistant expert (accountant), accountant expert, balance expert, liquidator expert (accountant)",assistant expert accountant accountant expert balance expert liquidator expert accountant
252305,Secretária(o) executiva(o),"Assessor de diretoria, Assessor de presidência, Assistente de diretoria, Assistente de presidência, Auxiliar administrativo de diretoria, Auxiliar administrativo de presidência, Secretário  de diretoria, Secretário  de gabinete, Secretário  de presidência, Secretário  pleno, Secretário sênior, Tecnólogo em secretariado","Directorate Advisor, Presidency Advisor, Board Assistant, Presidency Assistant, Board of Directors, Presidency Administrative Assistant, Board of Directors, Secretary of Cabinet, Secretary of Presidency, Full Secretary, Senior Secretary, Secretariat Technologist, Secretary",directorate advisor presidency advisor board assistant presidency assistant board director presidency administrative assistant board director secretary cabinet secretary presidency full secretary senior secretary secretariat technologist secretary
252310,Secretário  bilíngüe,"Assessor bilíngüe, Assistente bilíngüe, Auxiliar administrativo bilíngüe, Secretário  bilíngüe de diretoria, Secretário  bilíngüe de gabinete, Secretário  bilíngüe de presidência, Secretário  pleno  bilíngüe, Secretário  senior bilíngüe","Bilingual Advisor, Bilingual Assistant, Bilingual Administrative Assistant, Bilingual Secretary of Board, Bilingual Cabinet Secretary, Presidential Bilingual Secretary, Secretary Bilingual Secretary, Secretary Senior Bilingual",bilingual advisor bilingual assistant bilingual administrative assistant bilingual secretary board bilingual cabinet secretary presidential bilingual secretary secretary bilingual secretary secretary senior bilingual
252315,Secretária trilíngüe,"Assessor trilíngüe, Assistente trilíngüe, Auxiliar administrativo trilíngüe, Secretário  pleno  trilíngüe , Secretário  sênior trilíngüe , Secretário  trilíngüe de diretoria, Secretário  trilíngüe de gabinete, Secretário  trilíngüe de presidência","Trilingual Advisor, Trilingual Assistant, Trilingual Administrative Assistant, Full Trilingual Secretary, Senior Trilingual Secretary, Trilingual Directorate Secretary, Trilingual Cabinet Secretary, Trilingual Secretary of Presidency",trilingual advisor trilingual assistant trilingual administrative assistant full trilingual secretary senior trilingual secretary trilingual directorate secretary trilingual cabinet secretary trilingual secretary presidency
252320,Tecnólogo em secretariado escolar,"Secretário de escola(tecnólogo), Secretário escolar(tecnólogo)","School Secretary (Technologist), School Secretary (Technologist)",school secretary technologist school secretary technologist
252405,Analista de recursos humanos,"Analista de cargos e salários, Analista de ocupações","Positions and salary analyst, occupation analyst",position salary analyst occupation analyst
252505,Administrador de fundos e carteiras de investimento,,"the JSON object must be str, bytes or bytearray, not NoneType",json object must str byte bytearray nonetype
252510,Analista de câmbio,,"the JSON object must be str, bytes or bytearray, not NoneType",json object must str byte bytearray nonetype
252515,Analista de cobrança (instituições financeiras),,"the JSON object must be str, bytes or bytearray, not NoneType",json object must str byte bytearray nonetype
252525,Analista de crédito (instituições financeiras),,"the JSON object must be str, bytes or bytearray, not NoneType",json object must str byte bytearray nonetype
252530,Analista de crédito rural,,"the JSON object must be str, bytes or bytearray, not NoneType",json object must str byte bytearray nonetype
252535,Analista de leasing,,"the JSON object must be str, bytes or bytearray, not NoneType",json object must str byte bytearray nonetype
252540,Analista de produtos bancários,,"the JSON object must be str, bytes or bytearray, not NoneType",json object must str byte bytearray nonetype
252545,Analista financeiro (instituições financeiras),Analista de planejamento financeiro,Financial Planning Analyst,financial planning analyst
252550,Profissional de relações com investidores,"Profissional de relações com o mercado, Profissional de ri (relações com investidores)","Market relationships with the market, RI professional (investor relations)",market relationship market ri professional investor relation
252605,Gestor em segurança,"Gerente de segurança empresarial, Tecnólogo em gestão de segurança empresarial, Tecnólogo em gestão de segurança privada","Business Security Manager, Business Security Management Technologist, Private Security Management Technologist",business security manager business security management technologist private security management technologist
252705,Analista de pcp (programação e controle da produção),,"the JSON object must be str, bytes or bytearray, not NoneType",json object must str byte bytearray nonetype
252710,Analista de planejamento de materias,,"the JSON object must be str, bytes or bytearray, not NoneType",json object must str byte bytearray nonetype
252715,Analista de logistica,,"the JSON object must be str, bytes or bytearray, not NoneType",json object must str byte bytearray nonetype
252720,Analista de projetos logisticos,,"the JSON object must be str, bytes or bytearray, not NoneType",json object must str byte bytearray nonetype
252725,Analista de gestão de estoque,"Analista de estoque, Analista de inventário","Inventory Analyst, Inventory Analyst",inventory analyst inventory analyst
253110,Redator de publicidade,,"the JSON object must be str, bytes or bytearray, not NoneType",json object must str byte bytearray nonetype
253115,Publicitário,,"the JSON object must be str, bytes or bytearray, not NoneType",json object must str byte bytearray nonetype
253120,Diretor de mídia (publicidade),Coordenador de mídia,Media coordinator,medium coordinator
253125,Diretor de arte (publicidade),,"the JSON object must be str, bytes or bytearray, not NoneType",json object must str byte bytearray nonetype
253130,Diretor de criação,,"the JSON object must be str, bytes or bytearray, not NoneType",json object must str byte bytearray nonetype
253135,Diretor de contas (publicidade),,"the JSON object must be str, bytes or bytearray, not NoneType",json object must str byte bytearray nonetype
253140,Agenciador de propaganda,"Agenciador de publicidade, Corretor de anúncios (publicidade)","Advertising Agency, Advertising Broker (Advertising)",advertising agency advertising broker advertising
253205,Gerente de captação (fundos e investimentos institucionais),,"the JSON object must be str, bytes or bytearray, not NoneType",json object must str byte bytearray nonetype
253210,Gerente de clientes especiais (private),,"the JSON object must be str, bytes or bytearray, not NoneType",json object must str byte bytearray nonetype
253215,Gerente de contas - pessoa física e jurídica,,"the JSON object must be str, bytes or bytearray, not NoneType",json object must str byte bytearray nonetype
253220,Gerente de grandes contas (corporate),,"the JSON object must be str, bytes or bytearray, not NoneType",json object must str byte bytearray nonetype
253225,Operador de negócios,,"the JSON object must be str, bytes or bytearray, not NoneType",json object must str byte bytearray nonetype
253305,"Corretor de valores, ativos financeiros, mercadorias e derivativos","Corretor de mercadorias, Corretor de mercadorias e futuros, Operador de  mercadorias e derivativos, Operador de bolsa - pregão, Operador de bolsa de mercadorias e futuros, Operador de câmbio/comércio exterior, Operador de carteiras internacionais, Operador de mesa bolsa de valores, Operador de renda fixa, Operador de renda variável, Operador financeiro","Goods Broker, Broker and Future Broker, Goods and Derivative Operator, Bolsa - Pregão Operator, Future and Future Scholarship Operator, Exchange/Foreign Trade Operator, International Wallet Operator, Table Operator Bag, Operator, Operatorfixed income, variable income operator, financial operator",good broker broker future broker good derivative operator bolsa prego operator future future scholarship operator exchangeforeign trade operator international wallet operator table operator bag operator operatorfixed income variable income operator financial operator
253405,Analista de mídias sociais,"Analista de mídias digitais, Analista de redes sociais, Assistente de mídias sociais, Social media","Digital media analyst, social networking analyst, social media assistant, social media",digital medium analyst social networking analyst social medium assistant social medium
253410,Influenciador digital,"Criador de conteúdo digital, Gerador de conteúdo digital, Influencer, Produtor de conteúdo digital","Digital content creator, digital content generator, influencer, digital content producer",digital content creator digital content generator influencer digital content producer
254105,Auditor-fiscal da receita federal,,"the JSON object must be str, bytes or bytearray, not NoneType",json object must str byte bytearray nonetype
254110,Técnico da receita federal,,"the JSON object must be str, bytes or bytearray, not NoneType",json object must str byte bytearray nonetype
254205,Auditor-fiscal da previdência social,,"the JSON object must be str, bytes or bytearray, not NoneType",json object must str byte bytearray nonetype
254305,Auditor-fiscal do trabalho,,"the JSON object must be str, bytes or bytearray, not NoneType",json object must str byte bytearray nonetype
254310,Agente de higiene e segurança,,"the JSON object must be str, bytes or bytearray, not NoneType",json object must str byte bytearray nonetype
254405,Fiscal de tributos estadual,,"the JSON object must be str, bytes or bytearray, not NoneType",json object must str byte bytearray nonetype
254410,Fiscal de tributos municipal,,"the JSON object must be str, bytes or bytearray, not NoneType",json object must str byte bytearray nonetype
254415,Técnico de tributos estadual,,"the JSON object must be str, bytes or bytearray, not NoneType",json object must str byte bytearray nonetype
254420,Técnico de tributos municipal,,"the JSON object must be str, bytes or bytearray, not NoneType",json object must str byte bytearray nonetype
254505,Fiscal de atividades urbanas,"Agente fiscal(atividades urbanas), Agente vistor, Auditor de atividades urbanas, Auditor fiscal de atividades urbanas, Fiscal de atividades econômicas, Fiscal de feiras livres, Fiscal de posturas, Fiscal integrado, Fiscal municipal, Fiscal urbano, Inspetor fiscal","Fiscal Agent (Urban Activities), Visitor Agent, Urban Activities Auditor, Urban Activities Tax Auditor, Economic Activities, Free Feats Supervisor, Posture Supervisor, Integrated Inspector, Municipal Tax, Urban Tax, Fiscal Inspector, Fiscal",fiscal agent urban activity visitor agent urban activity auditor urban activity tax auditor economic activity free feat supervisor posture supervisor integrated inspector municipal tax urban tax fiscal inspector fiscal
261105,Arquivista pesquisador (jornalismo),,"the JSON object must be str, bytes or bytearray, not NoneType",json object must str byte bytearray nonetype
261110,Assessor de imprensa,,"the JSON object must be str, bytes or bytearray, not NoneType",json object must str byte bytearray nonetype
261115,Diretor de redação,Diretor adjunto,Deputy director,deputy director
261120,Editor,"Editor assistente, Editor de área, Editor de arte, Editor de fotografia, Editor de imagem, Editor de rádio, Editor de web, Editor executivo","Assistant editor, area editor, art editor, photography editor, image editor, radio editor, web editor, executive editor",assistant editor area editor art editor photography editor image editor radio editor web editor executive editor
261125,Jornalista,"Assistente de editorial, Colunista, Colunista de jornal, Correspondente de jornal, Correspondente de línguas estrangeiras, Cronista, Diarista-em jornal, Diretor noticiarista, Editorialista, Jornalista exclusive empregador, Jornalista-empregador, Radiojornalista, Roteirista de jornal, Roteirista na imprensa","Editorial assistant, columnist, newspaper columnist, correspondent of foreign languages, chronicler, day newspaper, news director, editorialist, exclusive employer journalist, journalist-unemploying, radio-jornalist, newspaper writer, press writer, press writer, writer in the press.",editorial assistant columnist newspaper columnist correspondent foreign language chronicler day newspaper news director editorialist exclusive employer journalist journalistunemploying radiojornalist newspaper writer press writer press writer writer press
261130,Produtor de texto,,"the JSON object must be str, bytes or bytearray, not NoneType",json object must str byte bytearray nonetype
261135,Repórter (exclusive rádio e televisão),"Repórter cinematográfico, Repórter correspondente, Repórter de área, Repórter de web, Repórter especial","Film reporter, corresponding reporter, area reporter, web reporter, special reporter",film reporter corresponding reporter area reporter web reporter special reporter
261140,Revisor de texto,,"the JSON object must be str, bytes or bytearray, not NoneType",json object must str byte bytearray nonetype
261205,Bibliotecário,"Bibliógrafo, Biblioteconomista, Cientista de informação, Consultor de informação, Especialista de informação, Gerente de informação, Gestor de informação","Bibliographer, library, information scientist, information consultant, information expert, information manager, information manager",bibliographer library information scientist information consultant information expert information manager information manager
261210,Documentalista,"Analista de documentação, Especialista de documentação, Gerente de documentação, Supervisor de controle de processos documentais, Supervisor de controle documental, Técnico de documentação, Técnico em suporte de documentação","Documentation Analyst, Documentation Expert, Documentation Manager, Documentary Process Control Supervisor, Document Control Supervisor, Documentation Technician, Documentation Technician",documentation analyst documentation expert documentation manager documentary process control supervisor document control supervisor documentation technician documentation technician
261215,Analista de informações (pesquisador de informações de rede),Pesquisador de informações de rede,Network Information Researcher,network information researcher
261305,Arquivista,"Administrador de arquivos, Encarregado de serviço de arquivo médico e estatística, Especialista em documentação arquivística, Especialista em organização de arquivos, Gestor de documentos","File Administrator, MEDICAL AND STATISTICAL FILE SERVICE, Specialist in Archival Documentation, File Organization Specialist, Document Manager",file administrator medical statistical file service specialist archival documentation file organization specialist document manager
261310,Museólogo,"Especialista em conservação de acervos, Especialista em documentação museológica, Especialista em educação em museus, Especialista em museografia de exposição","Specialist in conservation of collections, specialist in museum documentation, expert in museum education, expert in exhibition museography",specialist conservation collection specialist museum documentation expert museum education expert exhibition museography
261405,Filólogo,"Crítico textual, Filólogo dicionarista","Textual critic, dictionary philologist",textual critic dictionary philologist
261410,Intérprete,"Intérprete comercial, Intérprete de comunicação eletrônica, Intérprete de conferência, Intérprete simultâneo, Tradutor simultâneo","Commercial interpreter, electronic communication interpreter, conference interpreter, simultaneous interpreter, simultaneous translator",commercial interpreter electronic communication interpreter conference interpreter simultaneous interpreter simultaneous translator
261415,Lingüista,"Lexicógrafo, Lexicólogo, Lingüista dicionarista, Terminógrafo, Terminólogo, Vocabularista","Lexicographer, lexicologist, dictionary linguist, terminus, terminologist, vocabulary",lexicographer lexicologist dictionary linguist terminus terminologist vocabulary
261420,Tradutor,"Tradutor de textos eletrônicos, Tradutor de textos escritos, Tradutor público juramentado","Translator of electronic texts, translator of written texts, sworn public translator",translator electronic text translator written text sworn public translator
261425,Intérprete de língua de sinais,"Guia-intérprete, Intérprete de libras, Intérprete educacional, Tradutor de libras, Tradutor-intérprete de libras","Guide-Intorprete, Interpreter of Libras, Educational Interpreter, Libras Translator, Libras Translator-Intreprene",guideintorprete interpreter libra educational interpreter libra translator libra translatorintreprene
261430,Audiodescritor,,"the JSON object must be str, bytes or bytearray, not NoneType",json object must str byte bytearray nonetype
