CODIGO,TITULO,SINONIMOS,SINONIMOS_ENG,SINONIMOS_ENG_CLEAN
423115,Vistoriador veicular,Vistoriador de identificação veicular,Vehicle Identification Surveyor,vehicle identification surveyor
424105,Entrevistador censitário e de pesquisas amostrais,"Agente de coleta ( censo e pesquisas amostrais), Agente de pesquisa, Entrevistador de campo, Recenseador","Collection agent (census and sample research), research agent, field interviewer, censuser",collection agent census sample research research agent field interviewer censuser
424110,Entrevistador de pesquisa de opinião e mídia,"Entrevistador de cati (computer assisted telephone interviewing), Entrevistador de mídia, Entrevistador de pesquisa em profundidade","CATI Interviewer (Computer Assisted Telephone Interviewing), media interviewer, depth research interviewerer",cati interviewer computer assisted telephone interviewing medium interviewer depth research interviewerer
424115,Entrevistador de pesquisas de mercado,,"the JSON object must be str, bytes or bytearray, not NoneType",json object must str byte bytearray nonetype
424120,Entrevistador de preços,"Coletador de preços, Pesquisador de preços","Price collector, price researcher",price collector price researcher
424125,Escriturário  em  estatística,Técnico em estatística (escriturário),Statistics Technician (clerk),statistic technician clerk
424130,Entrevistador social,,"the JSON object must be str, bytes or bytearray, not NoneType",json object must str byte bytearray nonetype
424205,"Coordenador de provas (concurso, avaliação, exame)","Assistente de coordenação (concurso, avaliação, exame), Coordenador de provas de local de aplicação (concurso, avaliação, exame), Coordenador de provas estadual (concurso, avaliação, exame), Coordenador de provas municipal (concurso, avaliação, exame), Supervisor de local de aplicação (concurso, avaliação, exame)","Coordination Assistant (contest, evaluation, examination), Application Place Test Coordinator (Contest, Evaluation, Examination), State Test Coordinator (Contest, Evaluation, Examination), Municipal Test Coordinator (Contest, Evaluation, Exam),Place of application supervisor (contest, evaluation, examination)",coordination assistant contest evaluation examination application place test coordinator contest evaluation examination state test coordinator contest evaluation examination municipal test coordinator contest evaluation examplace application supervisor contest evaluation examination
424210,"Aplicador de provas (concurso, avaliação,exame)","Chefe de sala (concurso, avaliação, exame), Fiscal de banheiro (concurso, avaliação, exame), Fiscal de sala (concurso, avaliação, exame), Fiscal volante (concurso, avaliação, exame)","Hall head (competition, evaluation, examination), bathroom inspector (competition, evaluation, examination), room inspector (contest, evaluation, examination), steering wheel (contest, evaluation, examination)",hall head competition evaluation examination bathroom inspector competition evaluation examination room inspector contest evaluation examination steering wheel contest evaluation examination
510105,Supervisor de transportes,"Chefe de bilheteria, Encarregado de tráfego rodoviário e ferroviário, Fiscal de transporte rodoviário, Inspetor de bilheteria de transportes, Supervisor de bilheteira de transportes, Supervisor de estação ferroviária e rodoviária, Supervisor de movimento de trens, Supervisor de trens","Chief in charge of road and rail traffic, road transport inspector, transport box office inspector, transport box office supervisor, railway and bus station supervisor, trains supervisor supervisor, trains supervisor supervisor",chief charge road rail traffic road transport inspector transport box office inspector transport box office supervisor railway bus station supervisor train supervisor supervisor train supervisor supervisor
510110,Administrador de edifícios,"Administrador de prédios, Chefe de portaria (edifício), Encarregado de edifício, Síndico (edifícios)","Building Administrator, Chief of Ordinance (Building), building in charge, liquidator (buildings)",building administrator chief ordinance building building charge liquidator building
510115,Supervisor de andar,Encarregado de andar,Walking,walking
510120,Chefe de portaria de hotel,"Encarregado de portaria de hotel, Supervisor de hospedagem, Supervisor de recepção de hotel","Hotel Ordinance, Hosting Supervisor, Hotel Reception Supervisor",hotel ordinance hosting supervisor hotel reception supervisor
510130,Chefe de bar,"Chefe de barewomen, Chefe de bartander, Encarregado de bar e restaurante, Encarregado de cantina, Subchefe de bar, Supervisor de bar","BARMAN BOSS, BARTENDER BOSS, BAR AND RESTAURANT, CANTINA PURPOSE, BAR SEPPLAIN, BAR SUPERVISOR",barman bos bartender bos bar restaurant cantina purpose bar sepplain bar supervisor
510135,Maître,"Chef executivo nos serviços de alimentação, Chefe de fila nos serviços de alimentação, Maître - no serviço de alimentação, Maître de bar, Maître de boate, Maître de hotel, Maître de restaurante, Maître executivo, Sommalier","Executive Chef in Food Services, Head of Food Services, Maître - in the Food Service, Bar Maître, Boate Maître, Hotel Maître, Restaurante Maître, Executive Maître, Sommalier",executive chef food service head food service matre food service bar matre boate matre hotel matre restaurante matre executive matre sommalier
510205,Supervisor de lavanderia,"Chefe de lavagem de equipamentos de proteção individual  (epi), Chefe de lavanderia, Encarregado de lavanderia, Encarregado operacional de lavanderia, Supervisor operacional de lavanderia","Personal Protective Equipment Washing Head (PPE), Laundry Chief, Laundry, Laundry Operational In charge, Laundry Operational Supervisor",personal protective equipment washing head ppe laundry chief laundry laundry operational charge laundry operational supervisor
510305,Supervisor de bombeiros,"Encarregado de bombeiros, Líder de bombeiros","Fire Department, Fire Leader",fire department fire leader
510310,Supervisor de vigilantes,"Inspetor de segurança, Supervisor de segurança patrimonial, Supervisor de segurança (vigilância)","Security Inspector, Heritage Safety Supervisor, Safety Supervisor (Surveillance)",security inspector heritage safety supervisor safety supervisor surveillance
511105,Comissário de vôo,"Aeromoça, Comissário de bordo, Inspetor de bordo","Flight attendant, flight attendant, onboard inspector",flight attendant flight attendant onboard inspector
511110,Comissário de trem,,"the JSON object must be str, bytes or bytearray, not NoneType",json object must str byte bytearray nonetype
511115,Taifeiro (exceto militares),,"the JSON object must be str, bytes or bytearray, not NoneType",json object must str byte bytearray nonetype
511205,Fiscal de transportes coletivos (exceto trem),"Agente de serviços de fiscalização de transportes coletivos e licenciamento de veículos, Encarregado de tráfego, Escalante, Fiscal de linha, Fiscal de ônibus, Fiscal de operação, Fiscal de tráfego, Fiscal de viagens, Fiscal nos transportes, Fiscal rodoviário","Vehicle Transport and Licensing Surveillance Services Agent, Traffic Speaker, Range, Bus Tax, Operation Supervisor, Traffic Tax, Travel Inspector, Transportation, Road Tax",vehicle transport licensing surveillance service agent traffic speaker range bus tax operation supervisor traffic tax travel inspector transportation road tax
511210,Despachante de transportes coletivos (exceto trem),"Auxiliar de operação, Despachante de embarque, Despachante de tráfego, Despachante nos transportes, Encarregado de transporte coletivo (exceto trem)","Operation assistant, boarding dispatcher, traffic dispatcher, transport dispatcher, public transportation in charge (except train)",operation assistant boarding dispatcher traffic dispatcher transport dispatcher public transportation charge except train
511215,Cobrador de transportes coletivos (exceto trem),Trocador,Exchanger,exchanger
511220,"Bilheteiro (estações de metrô, ferroviárias e assemelhadas)",,"the JSON object must be str, bytes or bytearray, not NoneType",json object must str byte bytearray nonetype
511405,Guia de turismo,"Guia de turismo especializado em atrativo turístico, Guia de turismo especializado em excursão internacional, Guia de turismo especializado em excursão nacional, Guia de turismo especializado em turismo regional","Specialized Tourism Tourism Guide, Tourism Guide Specialized in International Excursion, Tourism Guide Specialized in National Excursion, Specialized Tourism Guide in Regional Tourism",specialized tourism tourism guide tourism guide specialized international excursion tourism guide specialized national excursion specialized tourism guide regional tourism
511505,Condutor de turismo de aventura,,"the JSON object must be str, bytes or bytearray, not NoneType",json object must str byte bytearray nonetype
511510,Condutor de turismo de pesca,"Piloteiro de turismo de pesca, Pirangueiro de turismo de pesca","Fishing Tourism Pilot, Fishing Tourism Pirangueiro",fishing tourism pilot fishing tourism pirangueiro
511515,Condutor turismo náutico,"Barqueiro (turismo náutico), Canoeiro (turismo náutico), Jangadeiro (turismo náutico)","Barqueiro (Nautical Tourism), Canoeiro (Nautical Tourism), Jangadeiro (Nautical Tourism)",barqueiro nautical tourism canoeiro nautical tourism jangadeiro nautical tourism
512105,Empregado  doméstico  nos serviços gerais,Caseiro,Homemade,homemade
512110,Empregado doméstico  arrumador,Arrumador no serviço doméstico,Domestic Service,domestic service
512115,Empregado doméstico  faxineiro,Faxineiro no serviço doméstico,Household janitor,household janitor
512120,Empregado doméstico diarista,,"the JSON object must be str, bytes or bytearray, not NoneType",json object must str byte bytearray nonetype
513105,Mordomo de residência,Governanta de residência,Housekeeper,housekeeper
513110,Mordomo de hotelaria,,"the JSON object must be str, bytes or bytearray, not NoneType",json object must str byte bytearray nonetype
513115,Governanta de hotelaria,"Assistente de governanta, Governanta executiva","HOUSEHIP ASSISTANT, EXECUTIVE GOVERNMENT",househip assistant executive government
513205,Cozinheiro geral,"Cozinheiro de restaurante, Merendeiro","Restaurant cook, lunchmaker",restaurant cook lunchmaker
513210,Cozinheiro do serviço doméstico,,"the JSON object must be str, bytes or bytearray, not NoneType",json object must str byte bytearray nonetype
513215,Cozinheiro industrial,Cozinheiro de restaurante de indústria,Industry restaurant cook,industry restaurant cook
513220,Cozinheiro de hospital,Cozinheiro hospitalar,Hospital cook,hospital cook
513225,Cozinheiro de embarcações,Cozinheiro de bordo,Cook,cook
513305,Camareiro de teatro,"Camareiro(a) de teatro, Guarda-roupeiro de teatro, Roupeiro de teatro","Theater Chamber, Theater Wardrobe, Theater Wardrobe",theater chamber theater wardrobe theater wardrobe
513310,Camareiro de televisão,"Camareiro(a) de televisão, Encarregado de guarda-roupa de televisão, Guarda-roupeiro de televisão, Roupeiro de televisão","Television chamberlain, in charge of a television wardrobe, television wardrobe, television wardrobe",television chamberlain charge television wardrobe television wardrobe television wardrobe
513315,Camareiro  de hotel,"Arrumadeira de hotel, Arrumador de hotel, Camareira de hotel","Hotel Standing Hotel, Hotel Hotel Hotel",hotel standing hotel hotel hotel hotel
513320,Camareiro de embarcações,"Camareiro no transporte marítimo e fluvial, Comissário de bordo no transporte marítimo","Chamberlain in maritime and river transport, flight attendant in maritime transportation",chamberlain maritime river transport flight attendant maritime transportation
513325,Guarda-roupeiro de cinema,"Encarregado de guarda-roupa de cinema, Roupeiro de cinema, Técnica de cinema","Cinema wardrobe, cinema wardrobe, film technique",cinema wardrobe cinema wardrobe film technique
513405,Garçom,"Atendente de buffet, Atendente de mesa, Auxiliar de maître, Garção, Garçom de bar, Passador de guarnição","Buffet attendant, table attendant, maître assistant, forgreen, bar waiter, garrison dowel",buffet attendant table attendant matre assistant forgreen bar waiter garrison dowel
513410,Sommelier,"Atendente de estabelecimento com cervejas artesanais, Cachacier, Cachacista, Degustador de vinho, Escanção, Especialista em cerveja, Especialista em vinho, Garçom (serviços de vinhos), Organizador de degustações e harmonizações de bebidas, Sommelier de cachaça, Sommelier de cerveja, Sommelier de saquê, Sommelier de vinho","Establishment attendant with craft beers, cachacier, cachacist, wine tasting, scanning, beer specialist, wine specialist, waiter (wine services), tasting organizer and beverage harmonizations, cachaça sommelier, beer sommelier, sommelier desake, wine sommelier",establishment attendant craft beer cachacier cachacist wine tasting scanning beer specialist wine specialist waiter wine service tasting organizer beverage harmonization cachaa sommelier beer sommelier sommelier desake wine sommelier
513415,Cumim,"Auxiliar de garçom, Auxiliar de mesa em restaurantes, hotéis e outros, Carregador de utensílios de cozinha","Waiter assistant, table assistant in restaurants, hotels and others, kitchen utensils charger",waiter assistant table assistant restaurant hotel others kitchen utensil charger
513420,Barman,"Atendente de bar, Auxiliar de barman, Balconista de bar, Preparador de drinques e bebidas","Bar attendant, bartender assistant, bar clerk, drinks and drinks trainer",bar attendant bartender assistant bar clerk drink drink trainer
513425,Copeiro,"Auxiliar de serviço de copa, Chefe da copa, Copeiro  de bar, Copeiro  de eventos, Copeiro  de hotel, Copeiro  de lanchonete, Copeiro  de restaurante","Cup service assistant, pantry chief, bar cope, event cope, hotel jam, cafeteria cope, restaurant cope",cup service assistant pantry chief bar cope event cope hotel jam cafeteria cope restaurant cope
513430,Copeiro de hospital,,"the JSON object must be str, bytes or bytearray, not NoneType",json object must str byte bytearray nonetype
513435,Atendente de lanchonete,"Ajudante, auxiliar de bar, Ajudante, auxiliar de lanchonete, Atendente de balcão de café, Balconista de lanchonete, Cafeteiro, Cantineiro (escola), Chapista de lanchonete, Servente de lanche","Assistant, bar assistant, helper, cafeteria assistant, coffee counter attendant, cafeteria clerk, coffee, cantener (school), cafeteria chapista, snack servant",assistant bar assistant helper cafeteria assistant coffee counter attendant cafeteria clerk coffee cantener school cafeteria chapista snack servant
513440,Barista,"Atendente barista, Atendente de cafeteria","Barista attendant, coffee shop attendant",barista attendant coffee shop attendant
513505,Auxiliar nos serviços de alimentação,"Ajudante de churrasqueiro, Ajudante de confeiteiro, Ajudante de cozinha, Ajudante de padeiro, Ajudante de pizzaiolo, Ajudante de sushiman, Auxiliar de churrasqueiro, Auxiliar de confeiteiro, Auxiliar de cozinha, Auxiliar de padeiro, Auxiliar de pizzaiolo, Auxiliar de sushiman, Forneiro(pizzaria), Lavador de pratos, Saladeiro, Salgadeiro","Churrasqueiro helper, icing assistant, kitchen assistant, baker, pizza -helper, sushiman helper, barbecue assistant, icing assistant, kitchen assistant, pizza -assistant, sushiman assistant, Forneiro (pizzeria), dishwasher, salair, salty",churrasqueiro helper icing assistant kitchen assistant baker pizza helper sushiman helper barbecue assistant icing assistant kitchen assistant pizza assistant sushiman assistant forneiro pizzeria dishwasher salair salty
513510,Lactarista,"Lactarista escolar, Lactarista hospitalar","School lactarist, hospital lactarist",school lactarist hospital lactarist
513605,Churrasqueiro,,"the JSON object must be str, bytes or bytearray, not NoneType",json object must str byte bytearray nonetype
513610,Pizzaiolo,,"the JSON object must be str, bytes or bytearray, not NoneType",json object must str byte bytearray nonetype
513615,Sushiman,,"the JSON object must be str, bytes or bytearray, not NoneType",json object must str byte bytearray nonetype
514105,Ascensorista,"Cabineiro de elevador, Encarregado de elevador, Operador de elevador","Elevator, elevator, elevator operator",elevator elevator elevator operator
514110,Garagista,"Encarregado de garagem, Manobrista","Garage in charge, valet",garage charge valet
514115,Sacristão,Fiscal de capela,Chapel inspector,chapel inspector
514120,Zelador de edifício,Zelador,Caretaker,caretaker
514205,Coletor de lixo domiciliar,"Agente de coleta de lixo, Coletor de lixo, Lixeiro","Garbage collection agent, garbage collector, garbage",garbage collection agent garbage collector garbage
514215,Varredor de rua,"Gari, Margarida","GARI, Daisy",gari daisy
514225,Trabalhador de serviços de limpeza e conservação de áreas públicas,,"the JSON object must be str, bytes or bytearray, not NoneType",json object must str byte bytearray nonetype
514230,Coletor de resíduos sólidos de serviços de saúde,"Coletor de lixo hospitalar, Coletor de resíduos de saúde, Coletor de resíduos hospitalares","Hospital waste collector, health waste collector, hospital waste collector",hospital waste collector health waste collector hospital waste collector
514305,Limpador de vidros,"Cordeiro - limpeza de vidros, Lavador de fachadas, Lavador de vidros, Limpador de janelas, Limpador de vidros alpinista industrial, Limpador de vidros de acesso por corda","Lamb - glass cleaning, facade washer, window washer, window cleaner, industrial climbing glass cleaner, rope access glass cleaner",lamb glass cleaning facade washer window washer window cleaner industrial climbing glass cleaner rope access glass cleaner
514310,Auxiliar de manutenção predial,"Auxiliar de manutenção de edificações, Auxiliar de manutenção elétrica e hidráulica","Building maintenance assistant, electrical and hydraulic maintenance assistant",building maintenance assistant electrical hydraulic maintenance assistant
514315,Limpador de fachadas,"Conservador de fachadas, Cordista, Limpador de fachada alpinista industrial, Limpador de fachada de acesso por corda, Limpador de fachadas com jato, Operador de balancim","Conservative of facades, cordist, industrial climber facade cleaner, rope access facade cleaner, jet facades cleaner, rocker operator",conservative facade cordist industrial climber facade cleaner rope access facade cleaner jet facade cleaner rocker operator
514320,Faxineiro,"Auxiliar de limpeza, Servente de limpeza","Cleaning assistant, cleaning servant",cleaning assistant cleaning servant
514325,Trabalhador da manutenção de edificações,"Auxiliar de conservação de barragens, Auxiliar de conservação de obras civis, Auxiliar de manutenção de edifícios, Oficial de manutenção, Oficial de manutenção predial, Oficial de serviços diversos na manutenção de edificações, Oficial de serviços gerais na manutenção de edificações, Trabalhador da manutenção de edificações alpinista industrial, Trabalhador da manutenção de edificações de acesso por corda, Trabalhador de manutenção de edifícios, Trabalhador na conservação de edifícios","Dam Conservation Assistant, Civil Works Conservation Assistant, Building Maintenance Assistant, Maintenance Officer, Building Maintenance Officer, Various Services Officer in the Maintenance of Buildings, General Services Officer in the Maintenance of Buildings, Maintenance WorkerBuildings industrial climbing, worker of maintenance of rope access buildings, building maintenance worker, worker in the conservation of buildings",dam conservation assistant civil work conservation assistant building maintenance assistant maintenance officer building maintenance officer various service officer maintenance building general service officer maintenance building maintenance workerbuildings industrial climbing worker maintenance rope access building building maintenance worker worker conservation building
514330,Limpador de piscinas,Piscineiro,Fisher,fisher
514335,Hidrojatista,,"the JSON object must be str, bytes or bytearray, not NoneType",json object must str byte bytearray nonetype
515105,Agente comunitário de saúde,"Agente de saúde, Visitador de saúde, Visitador de saúde em domicílio","Health Agent, Health Visitor, Home Health Visitor",health agent health visitor home health visitor
515110,Atendente de enfermagem,"Atendente de berçário, Atendente de centro cirúrgico, Atendente de enfermagem no serviço doméstico, Atendente de hospital, Atendente de serviço de saúde, Atendente de serviço médico, Atendente hospitalar, Atendente-enfermeiro, Maqueiro de hospital, Maqueiro hospitalar, Padioleiro-enfermeiro","Nursery attendant, Surgical Center attendant, Nursing Attendant at Domestic Service, Hospital Attendant, Health Service Attendant, Medical Service attendant, Hospital Attendant, Hospital Madeiro, Hospital Machine, Hospital Machine, Padioleiro-Fermel",nursery attendant surgical center attendant nursing attendant domestic service hospital attendant health service attendant medical service attendant hospital attendant hospital madeiro hospital machine hospital machine padioleirofermel
515115,Parteira leiga,"Assistente de parto, Parteira, Parteira prática","Delivery assistant, midwife, midwife",delivery assistant midwife midwife
515120,Visitador sanitário,"Auxiliar de sanitarista, Educador sanitário, Imunizador, Vigilante de saúde, Visitador sanitário domiciliar","Sanitarist assistant, sanitary educator, immunizer, health vigilante, home visitor",sanitarist assistant sanitary educator immunizer health vigilante home visitor
515125,Agente indígena de saúde,,"the JSON object must be str, bytes or bytearray, not NoneType",json object must str byte bytearray nonetype
515130,Agente indígena de saneamento,,"the JSON object must be str, bytes or bytearray, not NoneType",json object must str byte bytearray nonetype
515135,Socorrista (exceto médicos e enfermeiros),"Auxiliar de enfermagem socorrista, Bombeiro resgatista, Bombeiro socorrista, Resgatista, Resgatista socorrista, Técnico em enfermagem socorrista","Rescue Nursing Assistant, Rescue Firefighter, Rescue Firefighter, Rescue, Rescue Rescue, Rescue Technician Rescue",rescue nursing assistant rescue firefighter rescue firefighter rescue rescue rescue rescue technician rescue
515140,Agente de combate às endemias,"Agente de controle de vetores, Agente de contrrole de dengue, Guarda de endemias","Vector Control Agent, Dengue Control Agent, Endemic Guard",vector control agent dengue control agent endemic guard
515205,Auxiliar de banco de sangue,Flebotomista,Phlebotomist,phlebotomist
515210,Auxiliar de farmácia de manipulação,,"the JSON object must be str, bytes or bytearray, not NoneType",json object must str byte bytearray nonetype
515215,Auxiliar de laboratório de análises clínicas,Auxiliar técnico em patologia cínica,Technical Assistant in Cynical Pathology,technical assistant cynical pathology
515220,Auxiliar de laboratório de imunobiológicos,,"the JSON object must be str, bytes or bytearray, not NoneType",json object must str byte bytearray nonetype
515225,Auxiliar de produção farmacêutica,,"the JSON object must be str, bytes or bytearray, not NoneType",json object must str byte bytearray nonetype
515305,Educador social,"Arte educador, Educador de rua, Educador social de rua, Instrutor educacional, Orientador sócio educativo","Art Educator, Street Educator, Street Social Educator, Educational Instructor, Socio -Educational Advisor",art educator street educator street social educator educational instructor socio educational advisor
515310,Agente de ação social,"Agente de proteção social, Agente de proteção social de rua, Agente social","Social Protection Agent, Street Social Protection Agent, Social Agent",social protection agent street social protection agent social agent
515315,Monitor de dependente químico,"Conselheiro de dependente químico, Consultor em dependência química","Chemical dependent counselor, chemical dependency consultant",chemical dependent counselor chemical dependency consultant
515320,Conselheiro tutelar,,"the JSON object must be str, bytes or bytearray, not NoneType",json object must str byte bytearray nonetype
515325,Sócioeducador,"Agente de apoio socioeducativo, Agente de segurança socioeducativa, Agente educacional, Atendente de reintegração social","Socio -educational support agent, socio -educational security agent, educational agent, social reintegration attendant",socio educational support agent socio educational security agent educational agent social reintegration attendant
515330,Monitor de ressocialização prisional,"Agente de ressocialização prisional, Monitor disciplinar prisional","Prison Resocialization Agent, Prison Disciplinary Monitor",prison resocialization agent prison disciplinary monitor
516105,Barbeiro,,"the JSON object must be str, bytes or bytearray, not NoneType",json object must str byte bytearray nonetype
516110,Cabeleireiro,"Ajudante de cabeleireiro, Auxiliar de cabeleireiro, Cabeleireiro afro, Cabeleireiro escovista, Cabeleireiro feminino, Cabeleireiro masculino, Cabeleireiro penteador, Cabeleireiro tinturista, Cabeleireiro unissex","Hairdressing assistant, hairdresser, Afro hairdresser, hairdresser, female hairdresser, male hairdresser, combing hairdresser, killer hairdresser, unisex hairdresser",hairdressing assistant hairdresser afro hairdresser hairdresser female hairdresser male hairdresser combing hairdresser killer hairdresser unisex hairdresser
516120,Manicure/pedicure,Manicuro,Manicuro,manicuro
516125,Maquiador,"Maquiador social, Maquilador","Social Makeup artist, Makeupler",social makeup artist makeupler
