CODIGO,TITULO,SINONIMOS,SINONIMOS_ENG,SINONIMOS_ENG_CLEAN
752105,Artesão modelador (vidros),"Gambista (artesão de vidros), Mestre vidreiro, Miniaturista (artesão de vidros)","Gambist (Glass Artisan), Master Videreiro, Miniaturist (Glass Artisan)",gambist glass artisan master videreiro miniaturist glass artisan
752110,Moldador (vidros),"Moldador de lentes, Operador de máquina de estirar vidro, Operador de máquina de vidraria","Lens molder, glass machine operator, glassware machine operator",lens molder glass machine operator glassware machine operator
752115,Soprador de vidro,"Ampoleiro, Calibrador de tubos de vidro, Calibrador na fabricação de ampolas, Colhedor - em fábrica de vidro, Fechador de ampolas (garrafas térmicas), Soprador de vidro (material de laboratório)","Amprole, glass pipe calibrator, ampoule manufacturer, harvester - in glass factory, ampoule lock (thermos), glass blower (laboratory material)",amprole glass pipe calibrator ampoule manufacturer harvester glass factory ampoule lock thermos glass blower laboratory material
752120,Transformador de tubos de vidro,"Curvador de tubos de vidro, Hialotécnico","Glass, hyalotechnical",glass hyalotechnical
752205,Aplicador serigráfico em vidros,"Impressor serigráfico em vidros, Impressor silk screen em vidros, Serigrafista em vidros","VIDROS SERIGRAPHIC PRINTER, SILK SCREEN PRINTING IN VIDROS, VIDRATE SERIGATOR",vidros serigraphic printer silk screen printing vidros vidrate serigator
752210,Cortador de vidro,"Cortador de vidro - no comércio - exclusive conta própria e empregador, Cristaleiro (corte de vidros), Operador de máquina de corte (vidros), Traçador de vidros","Glass cutter - in commerce - exclusive account and employer, crystankr (glass cut), cutting machine operator (glass), glass tracer",glass cutter commerce exclusive account employer crystankr glass cut cutting machine operator glass glass tracer
752215,Gravador de vidro a  água-forte,Foscador de vidro a ácido,Glass Ficketing to Acid,glass ficketing acid
752220,Gravador de vidro a  esmeril,,"the JSON object must be str, bytes or bytearray, not NoneType",json object must str byte bytearray nonetype
752225,Gravador de vidro a  jato de areia,"Foscador de vidro a jato de areia, Jateador de materiais abrasivos, Jateador de vidro","Glass picker to sand jet, abrasive material blast, glass blast",glass picker sand jet abrasive material blast glass blast
752230,Lapidador de vidros e cristais,"Ajudante de lapidador (vidros), Beneficiador de cristal, Biselador de cristais, Operador de polidora de vidros e cristais, Polidor de vidros, Polidor de vidros e cristais","Lapidor helper (glass), crystal beneficiary, crystal bonvetor, glass and crystal polisher operator, glass polisher, glass and crystal polisher,",lapidor helper glass crystal beneficiary crystal bonvetor glass crystal polisher operator glass polisher glass crystal polisher
752235,Surfassagista,"Cortador de cristais de óptica, Lapidador de cristais de ótica, Operador de polidora de cristais de ótica, Polidor de cristais, Polidor de cristais de óptica, a máquina, Polidor de lentes","Optic crystal cutter, optical crystal lapidador, optical crystal polisher operator, crystal polishing, optic crystal polisher, the machine, lens polisher, lens",optic crystal cutter optical crystal lapidador optical crystal polisher operator crystal polishing optic crystal polisher machine lens polisher lens
752305,Ceramista,"Cerâmico, Ceramista multifuncional, Especialista em cerâmica","Ceramic, multifunctional ceramist, ceramic specialist",ceramic multifunctional ceramist ceramic specialist
752310,Ceramista (torno de pedal e motor),"Ceramista artesanal, Ceramista artístico, Oleiro em torno de pedal","Artisanal ceramist, artistic ceramist, potter around pedal",artisanal ceramist artistic ceramist potter around pedal
752315,Ceramista (torno semi-automático),"Operador de torno semi-automático (cerâmica), Torneiro ceramista","Semi-automatic lathe operator (ceramic), ceramist turner",semiautomatic lathe operator ceramic ceramist turner
752320,Ceramista modelador,"Modelador ceramista, Modelador de porcelana, Modelador em cerâmica, Modelista em cerâmica","Ceramist modeler, porcelain modeler, ceramic modeler, ceramic modeler",ceramist modeler porcelain modeler ceramic modeler ceramic modeler
752325,Ceramista moldador,"Ceramista (confecção de moldes), Ceramista fundidor de molde, Formista (cerâmica), Fundidor de barbotina, Moldador de cerâmica, Moldador em barbotina, Moldador em cerâmica, Preparador de moldes (cerâmica)","Ceramist (molding), mold casting ceramist, formist (ceramic), barbotin castor, ceramic molder, barbotine molder, ceramic molder, mold preparer (ceramic)",ceramist molding mold casting ceramist formist ceramic barbotin castor ceramic molder barbotine molder ceramic molder mold preparer ceramic
752330,Ceramista prensador,"Ceramista batedor de prensa extrusora, Ceramista operador de prensa hidráulica, Ceramista prensador (prensa a  fricção), Ceramista prensador (prensa extrusora), Ceramista prensador (prensa hidráulica), Ceramista prensista (prensa extrusora), Ceramista prensista (prensa hidráulica), Prensador cerâmico","Extruder press beater, hydraulic press operator, pressing ceramist (friction press), pressing ceramist (extruder press), pressing ceramist (hydraulic press), prensist ceramist (extruder press), ceramist prensist (hydraulic press), ceramic presser presser",extruder press beater hydraulic press operator pressing ceramist friction press pressing ceramist extruder press pressing ceramist hydraulic press prensist ceramist extruder press ceramist prensist hydraulic press ceramic presser presser
752405,Decorador de cerâmica,"Aplicador de decalque em cerâmica, Aplicador de impressos em cerâmica, Ceramista escultor (acabamento), Decalcador em cerâmica, Decorador ceramista, Escultor de vidro, Preparador de tela serigráfica para cerâmica","Ceramic decal applicator, ceramic print applicator, sculptor ceramist (finishing), ceramic decal, ceramist decorator, glass sculptor, ceramic screen trainer",ceramic decal applicator ceramic print applicator sculptor ceramist finishing ceramic decal ceramist decorator glass sculptor ceramic screen trainer
752410,Decorador de vidro,"Decorador de vidro a  decalque, Decorador de vidro a  pistola, Escultor de vidro (acabamento), Jateador de vidro não plano, Lapidador de vidros (acabamento), Preparador de tela serigráfica de vidro, Riscador de copos","Glass Decorator Decal, Glass Decorator The Pistol, Glass Sculptor (Finishing), Non -Plan Glass Plastor, Glass Wall (Finishing), Glass Screen Preparer, Cup Rismer",glass decorator decal glass decorator pistol glass sculptor finishing non plan glass plastor glass wall finishing glass screen preparer cup rismer
752415,Decorador de vidro à pincel,,"the JSON object must be str, bytes or bytearray, not NoneType",json object must str byte bytearray nonetype
752420,Operador de esmaltadeira,"Esmaltador cerâmico, Esmaltador de cerâmica por imersão, Operador de máquina cerâmica (pintor), Operador de máquina de esmaltação cerâmica, Pintor de cerâmica a  pistola, Pistoleiro (cerâmica), Vidrador-esmaltador em cerâmica, Vitrificador","Ceramic enameor, immersion ceramic enameor, ceramic machine operator (painter), ceramic enamel operator, ceramic painter the pistol, gunman (ceramic), ceramic-enameor, vitrifier",ceramic enameor immersion ceramic enameor ceramic machine operator painter ceramic enamel operator ceramic painter pistol gunman ceramic ceramicenameor vitrifier
752425,Operador de espelhamento,"Espelhador, Espelhador - na fabricação de espelhos, Espelhador (esmaltador), Foscador de espelhos, Opacador, Prateador de espelho","Mirror, Mirror - In the manufacture of mirrors, mirror (enamel), mirrors, potter, mirror shelter",mirror mirror manufacture mirror mirror enamel mirror potter mirror shelter
752430,"Pintor de cerâmica, a  pincel","Ceramista fileteiro, Pintor de cerâmica manual","Filetteiro ceramist, manual ceramic painter",filetteiro ceramist manual ceramic painter
760105,Contramestre de acabamento (indústria têxtil),"Encarregado de acabamento de estampa, Encarregado de acabamento (indústria têxtil), Encarregado de mecerização","Stamp finish in charge, in charge of finishing (textile industry), in charge of filing",stamp finish charge charge finishing textile industry charge filing
760110,Contramestre de fiação (indústria têxtil),Encarregado geral de fiação,General Wiring,general wiring
760115,Contramestre de malharia (indústria têxtil),Encarregado geral de malharia,General Mesh,general mesh
760120,Contramestre de tecelagem (indústria têxtil),"Contramestre de indústrias têxtil, Encarregado geral de tecelagem","Against the textile industries, general in charge of weaving",textile industry general charge weaving
760125,Mestre (indústria têxtil e de confecções),"Mestre de acabamento de fios, Mestre de acabamento em confecção, Mestre de alvejamento de tecidos, Mestre de bobinadeira têxtil, Mestre de cerzideira, Mestre de espularia, Mestre de estampagem, Mestre de fiação, Mestre de fiação de algodão, Mestre de fiação de juta, Mestre de fiação de lã, Mestre de fiação de linho, Mestre de fiação de tecelagem, Mestre de fiação e tecelagem de rami, Mestre de indústria têxtil, Mestre de malharia, Mestre de preparação de tear, Mestre de preparação de tecelagem, Mestre de preparação e revisão de bordados, Mestre de retorcedeira, Mestre de tapeçaria, Mestre de tecelagem, Mestre de tecelagem de juta, Mestre de tecelagem de malhas, Mestre de tecelagem de máquina circular, Mestre de tecelagem de rendas, Mestre de tecelagem de telas, Mestre de texturização de fios, Mestre de tingimento (indústria têxtil e de confecções), Mestre de torção de fios, Mestre de urdimento, Mestre gravador têxtil","Master of Wire Finishing, Master of Finishing, Tissue Shipping Master, Textile Bobinagem Master, Cerzideira Master, Folaria Master, Stamping Master, Wiring Master, Cotton Wiring Master, Jute Wiring Master, Wool wiring master, linen wiring master, weaving master, wiring master and rami weaving, textile industry master, mesh master, loom preparation master, weaving master, master ofPreparation and revision of embroidery, twist master, tapestry master, weaving master, jute weaving master, mesh weaving master, circular machine weaving master, lace weaving master, screens' weaving master, masterWire texturization, master of dyeing (textile and confectionery industry), wire torsion master, urgent master, Textile Master",master wire finishing master finishing tissue shipping master textile bobinagem master cerzideira master folaria master stamping master wiring master cotton wiring master jute wiring master wool wiring master linen wiring master weaving master wiring master ramus weaving textile industry master mesh master loom preparation master weaving master master ofpreparation revision embroidery twist master tapestry master weaving master jute weaving master mesh weaving master circular machine weaving master lace weaving master screen weaving master masterwire texturization master dyeing textile confectionery industry wire torsion master urgent master textile master
760205,Supervisor de curtimento,Técnico em curtimento (supervisor de primeira linha),LIKE TECHNICIAN (FIRST LINE SUPERVISOR),like technician first line supervisor
760305,Encarregado de corte na confecção do vestuário,"Coordenador de corte na confecção do vestuário, Supervisor de corte na confecção do vestuário","Cutting coordinator in the clothing making, cutting supervisor in the clothing preparation",cutting coordinator clothing making cutting supervisor clothing preparation
760310,Encarregado de costura na confecção do vestuário,"Coordenador de bordado, Coordenador de costura do vestuário, Supervisor de costura do vestuário","Embroidery Coordinator, Clothing Sewing Coordinator, Clothing Sewing Supervisor",embroidery coordinator clothing sewing coordinator clothing sewing supervisor
760405,Supervisor  (indústria de calçados e artefatos de couro),"Contramestre da indústria de calçados, Mestre (indústria de calçados e artefatos de couro), Mestre sapateiro, Supervisor de acabamento de confecção de calçados, Supervisor de alta freqüência de confecção de calçados, Supervisor de corte de confecção de calçados, Supervisor de injeção de confecção de calçados, Supervisor de matrizaria de confecção de calçados, Supervisor de modelagem de confecção de calçados, Supervisor de montagem de confecção de calçados, Supervisor de pesponto de confecção de calçados, Supervisor de pré-frezado de confecção de calçados","Contramestre of the footwear industry, Master (Shoe and Leather Artifacts Industry), Master Shoemaker, Footwear Making Supervisor, high frequency supervisor of shoe making, shoe making supervisor, confection injection supervisor supervisor supervisorFootwear, Supervisor of Matrizar Shoes, Supervisor of Modeling Footwear Modeling, Footwear Making Supervisor, Footwear Confection Pesponto Supervisor, Pre-Freito Shop Supervisor",contramestre footwear industry master shoe leather artifact industry master shoemaker footwear making supervisor high frequency supervisor shoe making shoe making supervisor confection injection supervisor supervisor supervisorfootwear supervisor matrizar shoe supervisor modeling footwear modeling footwear making supervisor footwear confection pesponto supervisor prefreito shop supervisor
760505,"Supervisor da confecção de artefatos de tecidos, couros e afins",Supervisor de produção (artefatos de couro),Production Supervisor (leather artifacts),production supervisor leather artifact
760605,Supervisor das artes gráficas  (indústria editorial e gráfica),"Chefe de divisão gráfica, Chefe de seção de artes gráficas, Coordenador de artes gráficas, Encarregado de gráfica, Mestre das artes gráficas (indústria editorial e gráfica), Mestre de fotogravuras, Mestre de fotolito, Mestre de gravação (indústria gráfica), Mestre de produção (indústria gráfica), Mestre de serviços gráficos, Mestre gráfico, Mestre gravador de clichê, Mestre impressor, Mestre impressor calcográfico, Mestre impressor de off-set, Mestre litográfico, Mestre tipógrafo","Head of Graphic Division, Head of Graphic Arts Section, Graphic Arts Coordinator, Graphic Staff, Master of Graphic Arts (Editorial and Graphic Industry), Master of Photographs, Master of Photolith, Master of Recording (Graphic Industry), Master ofProduction (graphic industry), master of graphic services, graphic master, cliché master recorder, printer master, calcographic master, off-set printing master, lithographic master, typographer",head graphic division head graphic art section graphic art coordinator graphic staff master graphic art editorial graphic industry master photograph master photolith master recording graphic industry master ofproduction graphic industry master graphic service graphic master clich master recorder printer master calcographic master offset printing master lithographic master typographer
761005,Operador polivalente da indústria têxtil,,"the JSON object must be str, bytes or bytearray, not NoneType",json object must str byte bytearray nonetype
761105,Classificador de fibras têxteis,"Classificador de algodão - no beneficiamento de fibras têxteis, Classificador de algodão em caroço, Classificador de algodão em pluma, Classificador de fibras na indústria têxtil, Classificador de lã na indústria têxtil, Classificador de sisal - no beneficiamento","Cotton Classifier - In the benefit of textile fibers, lump cotton classifier, pluma cotton classifier, fiber classifier in the textile industry, wool classifier in the textile industry, sisal classifier - in beneficiation",cotton classifier benefit textile fiber lump cotton classifier pluma cotton classifier fiber classifier textile industry wool classifier textile industry sisal classifier beneficiation
761110,Lavador de lã,"Lavador de fibras na indústria têxtil, Operador de máquina de lavanderia de lã, Secador de lã","Fiber washer in the textile industry, wool laundry machine operator, wool dryer",fiber washer textile industry wool laundry machine operator wool dryer
761205,Operador de abertura (fiação),"Abridor de lã, Operador batedor de fibras, Operador de abridor de fibras, Operador misturador de fibras, Triador de lã","Wool operator, fiber beater operator, fiber operator, fiber mixer operator, wool triador",wool operator fiber beater operator fiber operator fiber mixer operator wool triador
761210,Operador de binadeira,,"the JSON object must be str, bytes or bytearray, not NoneType",json object must str byte bytearray nonetype
761215,Operador de bobinadeira,,"the JSON object must be str, bytes or bytearray, not NoneType",json object must str byte bytearray nonetype
761220,Operador de cardas,Cardista,Carder,carder
761225,Operador de conicaleira,Maquinista de conicaleira,Conical,conical
761230,Operador de filatório,"Arriador de filatório, Fiandeiro, Maquinista de filatório","Philatory Arrialer, Swing, Philatory Dodge",philatory arrialer swing philatory dodge
761235,Operador de laminadeira e reunideira,,"the JSON object must be str, bytes or bytearray, not NoneType",json object must str byte bytearray nonetype
761240,Operador de maçaroqueira,"Acertador de maçaroqueira, Distribuidor de maçarocas, Maçaroqueiro","Slimming, Maçarocas, Maçaroqueiro",slimming maarocas maaroqueiro
761245,Operador de open-end,,"the JSON object must be str, bytes or bytearray, not NoneType",json object must str byte bytearray nonetype
761250,Operador de passador (fiação),"Operador passadista (fiação), Operador passadorista (fiação)","Passadais Operator (wiring), Pastorist Operator (wiring)",passadais operator wiring pastorist operator wiring
761255,Operador de penteadeira,,"the JSON object must be str, bytes or bytearray, not NoneType",json object must str byte bytearray nonetype
761260,Operador de retorcedeira,,"the JSON object must be str, bytes or bytearray, not NoneType",json object must str byte bytearray nonetype
761303,Tecelão (redes),Tecedor de redes,Networking,networking
761306,Tecelão (rendas e bordados),"Labirinteira (rendas e bordados), Tecelão de bordados, Tecelão de rendas","Labirinter (lace and embroidery), embroidery weaver, lace weaver",labirinter lace embroidery embroidery weaver lace weaver
761309,Tecelão (tear automático),,"the JSON object must be str, bytes or bytearray, not NoneType",json object must str byte bytearray nonetype
761312,Tecelão (tear jacquard),Operador de tear de jacquard,Jacquard loom operator,jacquard loom operator
761315,Tecelão (tear mecânico de maquineta),Operador de tear mecânico de maquineta,Mechanical Machinet loom operator,mechanical machinet loom operator
761318,Tecelão (tear mecânico de xadrez),Operador de tear mecânico de xadrez,Mechanical chess loom operator,mechanical chess loom operator
761321,Tecelão (tear mecânico liso),Operador de tear mecânico liso,Smooth mechanical loom operator,smooth mechanical loom operator
761324,"Tecelão (tear mecânico, exceto jacquard)","Operador de tear mecânico, exceto jacquad","Mechanical loom operator, except jacquard",mechanical loom operator except jacquard
761327,"Tecelão de malhas, a  máquina","Enformador de malharia, Operador de malhas, a  máquina","Knitting enforcer, mesh operator, the machine",knitting enforcer mesh operator machine
761330,Tecelão de malhas (máquina circular),Operador de máquina circular de malharia,Circular Knitting Machine Operator,circular knitting machine operator
761333,Tecelão de malhas (máquina retilínea),Operador de máquina retilínea de malharia,Retilinear Machary Operator,retilinear machary operator
761336,"Tecelão de meias, a  máquina",Enformador de meias,Sock,sock
761339,Tecelão de meias (máquina circular),,"the JSON object must be str, bytes or bytearray, not NoneType",json object must str byte bytearray nonetype
761342,Tecelão de meias (máquina retilínea),,"the JSON object must be str, bytes or bytearray, not NoneType",json object must str byte bytearray nonetype
761345,"Tecelão de tapetes, a  máquina","Confeccionador de tapetes e passadeiras, a  máquina","Carpet and treadmill clothing, the machine",carpet treadmill clothing machine
761348,Operador de engomadeira de urdume,,"the JSON object must be str, bytes or bytearray, not NoneType",json object must str byte bytearray nonetype
761351,Operador de espuladeira,,"the JSON object must be str, bytes or bytearray, not NoneType",json object must str byte bytearray nonetype
761354,Operador de máquina de cordoalha,Barbanteiro,Stringer,stringer
761357,Operador de urdideira,,"the JSON object must be str, bytes or bytearray, not NoneType",json object must str byte bytearray nonetype
761360,Passamaneiro a  máquina,"Tecelão de fitas, Tecelão de tear de fita","Ribbon weaver, tape loom weaver",ribbon weaver tape loom weaver
761363,Remetedor de fios,,"the JSON object must be str, bytes or bytearray, not NoneType",json object must str byte bytearray nonetype
761366,Picotador de cartões jacquard,Perfurador de cartões jacquard,Jacquard card perforator,jacquard card perforator
761405,Alvejador (tecidos),"Operador de máquinas de cozinhamento e alvejamento de fibras soltas, fios e tecidos","Kitchen machine operator and loose fiber, wires and tissues",kitchen machine operator loose fiber wire tissue
761410,Estampador de tecido,,"the JSON object must be str, bytes or bytearray, not NoneType",json object must str byte bytearray nonetype
761415,Operador de calandras (tecidos),"Operador de máquinas de flanelar (peletizar, lixar) tecidos","Flanelar machine operator (pelletia, sanding) tissues",flanelar machine operator pelletia sanding tissue
761420,Operador de chamuscadeira de tecidos,Operador de chamuscadeira/desengomagem de tecidos,Chamuscader Operator/Tissue Desengomage,chamuscader operatortissue desengomage
761425,Operador de impermeabilizador de tecidos,"Mercerizador de fios e tecidos, Operador de máquinas de impermeabilizar tecidos, Operador de máquinas de mercerizar fios e tecidos","Wire and Tissue Mercerizer, Operator of Waterproof Tissue Machinery, Operator of Mercerize Wire and Tissues",wire tissue mercerizer operator waterproof tissue machinery operator mercerize wire tissue
761430,Operador de máquina de lavar fios e tecidos,"Auxiliar-ajudante de operador de máquinas de lavar fibras, fios, tecidos e peças confeccionadas, Operador de máquinas de lavar fibras soltas, fios, tecidos e peças confeccionadas","Assistant Assistant of Washing Machine Operator Fiber, Threads, Fabrics and Parts Made, Loose Fiber Washing Machine Operator, Wires, Fabrics and Pieces Made",assistant assistant washing machine operator fiber thread fabric part made loose fiber washing machine operator wire fabric piece made
761435,Operador de rameuse,,"the JSON object must be str, bytes or bytearray, not NoneType",json object must str byte bytearray nonetype
761805,Inspetor de estamparia (produção têxtil),Revisor de silk-screen,Silk-screen reviewer,silkscreen reviewer
761810,Revisor de fios (produção têxtil),Inspetor de bobinas (produção têxtil),Coil inspector (textile production),coil inspector textile production
761815,Revisor de tecidos acabados,"Classificador de tecidos, Dobrador-revisor - em fábrica de tecidos, Espinçador (produção têxtil), Examinador de meias (produção têxtil), Inspetor de pano, Pinçador (produção têxtil), Revisor têxtil","Fabric Classifier, Revisor Folder - In Fabric Factory, Espinator (Textile Production), Sock Examinator (Textile Production), Cloth Inspector, Tryer (Textile Production), Textile Reviewer",fabric classifier revisor folder fabric factory espinator textile production sock examinator textile production cloth inspector tryer textile production textile reviewer
761820,Revisor de tecidos crus,Inspetor de tecidos crus,Raw fabric inspector,raw fabric inspector
762005,Trabalhador polivalente do curtimento de couros e peles,,"the JSON object must be str, bytes or bytearray, not NoneType",json object must str byte bytearray nonetype
762105,Classificador de peles,,"the JSON object must be str, bytes or bytearray, not NoneType",json object must str byte bytearray nonetype
762110,"Descarnador de couros e peles, à maquina",Trinchador,Trinker,trinker
762115,Estirador de couros e peles (preparação),,"the JSON object must be str, bytes or bytearray, not NoneType",json object must str byte bytearray nonetype
762120,Fuloneiro,,"the JSON object must be str, bytes or bytearray, not NoneType",json object must str byte bytearray nonetype
762125,Rachador de couros e peles,Embocador,Niger,niger
762205,Curtidor (couros e peles),"Auxiliar de curtimento, Curtidor de couro, Depilador de couros e peles, Enxugador de couros e peles, Operador de enxugador (couros), Operador de fulão","Tanning assistant, leather tanner, leather and skins, leather and skins wiping, wiping operator (leather), broken operator",tanning assistant leather tanner leather skin leather skin wiping wiping operator leather broken operator
762210,Classificador de couros,,"the JSON object must be str, bytes or bytearray, not NoneType",json object must str byte bytearray nonetype
762215,Enxugador de couros,,"the JSON object must be str, bytes or bytearray, not NoneType",json object must str byte bytearray nonetype
762220,Rebaixador de couros,Rebaixador de base (couros),Base Defendant (leather),base defendant leather
762305,Estirador de couros e peles (acabamento),,"the JSON object must be str, bytes or bytearray, not NoneType",json object must str byte bytearray nonetype
