CODIGO,TITULO,SINONIMOS,SINONIMOS_ENG,SINONIMOS_ENG_CLEAN
10105,Oficial general da aeronáutica,"Brigadeiro, Major-brigadeiro, Marechal-do-ar, Tenente-brigadeiro","Brigadeiro, Major-Brigadier, Marshal-Do, Lieutenant Brigadier",brigadeiro majorbrigadier marshaldo lieutenant brigadier
10110,Oficial general do exército,"General-de-brigada, General-de-divisão, General-de-exército, Marechal","Brigade General, Division General, General-of-Exempt, Marshal",brigade general division general generalofexempt marshal
10115,Oficial general da marinha,"Almirante, Almirante-de-esquadra, Contra-almirante, Vice-almirante","Admiral, Admiral-de-Squad, Countertop, Vice Admiral",admiral admiraldesquad countertop vice admiral
10205,Oficial da aeronáutica,"Capitão da aeronáutica, Coronel da aeronáutica, Major da aeronáutica, Primeiro-tenente da aeronáutica, Segundo-tenente da aeronáutica, Tenente-coronel da aeronáutica","Captain of Aeronautics, Aeronautics Colonel, Aeronautics Major, Prime Lieutenant of Aeronautics, according to Aeronautics Lieutenant, Lieutenant Colonel of Aeronautics",captain aeronautics aeronautics colonel aeronautics major prime lieutenant aeronautics according aeronautics lieutenant lieutenant colonel aeronautics
10210,Oficial do exército,"Capitão do exército, Coronel do exército, Major do exército, Primeiro-tenente do exército, Segundo-tenente do exército, Tenente-coronel do exército","Army Captain, Army Colonel, Army Major, Army First Lieutenant, Army Lieutenant Lieutenant Colonel of the Army",army captain army colonel army major army first lieutenant army lieutenant lieutenant colonel army
10215,Oficial da marinha,"Capitão-de-corveta, Capitão-de-fragata, Capitão-de-mar-e-guerra, Capitão-tenente da marinha, Primeiro-tenente da marinha, Segundo-tenente da marinha","Captain-de-Corvette, Captain-of-Fagat, Captain-of-Mar and War, Navy Captain, Navy Prime Lieutenant, according to Navy Latent",captaindecorvette captainoffagat captainofmar war navy captain navy prime lieutenant according navy latent
10305,Praça da aeronáutica,"Cabo da aeronáutica, Primeiro-sargento da aeronáutica, Segundo-sargento da aeronáutica, Soldado da aeronáutica, Suboficial da aeronáutica, Taifeiro da aeronáutica, Taifeiro-mor da aeronáutica, Terceiro-sargento da aeronáutica","Aeronautics Cape, First Aeronautics, according to Aeronautics, Aeronautics Soldier, Aeronautics, Aeronautics Taifeiro, Aeronautics Room, Third Aeronautics Aeronautics",aeronautics cape first aeronautics according aeronautics aeronautics soldier aeronautics aeronautics taifeiro aeronautics room third aeronautics aeronautics
10310,Praça do exército,"Cabo do exército, Primeiro-sargento do exército, Segundo-sargento, Soldado do exército, Subtenente do exército, Taifeiro do exército, Taifeiro-mor do exército, Terceiro-sargento do exército","Army Cape, Army First Samplent, according to Army Solder, Army Lieutenant, Army Taifeiro, Army Army Roil, Army Third Sergeant",army cape army first samplent according army solder army lieutenant army taifeiro army army roil army third sergeant
10315,Praça da marinha,"Cabo da marinha, Marinheiro, Primeiro-sargento da marinha, Segundo-sargento da marinha, Soldado fuzileiro naval, Suboficial da marinha, Terceiro-sargento da marinha","Navy, sailor, first-level navy, second-navy-sergeant, naval marine soldier, navy, third party, navy",navy sailor firstlevel navy secondnavysergeant naval marine soldier navy third party navy
20105,Coronel da polícia militar,,"the JSON object must be str, bytes or bytearray, not NoneType",json object must str byte bytearray nonetype
20110,Tenente-coronel da polícia militar,,"the JSON object must be str, bytes or bytearray, not NoneType",json object must str byte bytearray nonetype
20115,Major da polícia militar,,"the JSON object must be str, bytes or bytearray, not NoneType",json object must str byte bytearray nonetype
20205,Capitão da polícia militar,,"the JSON object must be str, bytes or bytearray, not NoneType",json object must str byte bytearray nonetype
20305,Primeiro tenente de polícia militar,,"the JSON object must be str, bytes or bytearray, not NoneType",json object must str byte bytearray nonetype
20310,Segundo tenente de polícia militar,,"the JSON object must be str, bytes or bytearray, not NoneType",json object must str byte bytearray nonetype
21105,Subtenente da policia militar,,"the JSON object must be str, bytes or bytearray, not NoneType",json object must str byte bytearray nonetype
21110,Sargento da policia militar,,"the JSON object must be str, bytes or bytearray, not NoneType",json object must str byte bytearray nonetype
21205,Cabo da polícia militar,,"the JSON object must be str, bytes or bytearray, not NoneType",json object must str byte bytearray nonetype
21210,Soldado da polícia militar,,"the JSON object must be str, bytes or bytearray, not NoneType",json object must str byte bytearray nonetype
30105,Coronel bombeiro militar,Coronel do corpo de bombeiros militar,Military Fire Department Colonel,military fire department colonel
30110,Major bombeiro militar,Major do corpo de bombeiros militar,Major of the Military Fire Department,major military fire department
30115,Tenente-coronel bombeiro militar,Tenente-coronel do corpo de bombeiros militar,Lieutenant Colonel of the Military Fire Department,lieutenant colonel military fire department
30205,Capitão bombeiro militar,Capitão do corpo de bombeiros militar,Captain of the Military Fire Department,captain military fire department
30305,Tenente do corpo de bombeiros militar,"Oficial subalterno do corpo de bombeiros militar, Primeiro-tenente bombeiro militar, Primeiro-tenente do corpo de bombeiros, Segundo-tenente bombeiro militar, Segundo-tenente do corpo de bombeiros","Subaltern Officer of the Military Fire Department, First Lieutenant Military Firefighter, Fire Department First Lieutenant, according to Military Firefighter, Second Lieutenant of the Fire Department",subaltern officer military fire department first lieutenant military firefighter fire department first lieutenant according military firefighter second lieutenant fire department
31105,Subtenente bombeiro militar,Subtenente do corpo de bombeiros militar,Military Fire Department Lieutenant,military fire department lieutenant
31110,Sargento bombeiro militar,Sargento do corpo de bombeiros militar,Military Fire Department Sergeant,military fire department sergeant
31205,Cabo bombeiro militar,,"the JSON object must be str, bytes or bytearray, not NoneType",json object must str byte bytearray nonetype
31210,Soldado bombeiro militar,,"the JSON object must be str, bytes or bytearray, not NoneType",json object must str byte bytearray nonetype
111105,Senador,,"the JSON object must be str, bytes or bytearray, not NoneType",json object must str byte bytearray nonetype
111110,Deputado federal,,"the JSON object must be str, bytes or bytearray, not NoneType",json object must str byte bytearray nonetype
111115,Deputado estadual e distrital,,"the JSON object must be str, bytes or bytearray, not NoneType",json object must str byte bytearray nonetype
111120,Vereador,,"the JSON object must be str, bytes or bytearray, not NoneType",json object must str byte bytearray nonetype
111205,Presidente da república,,"the JSON object must be str, bytes or bytearray, not NoneType",json object must str byte bytearray nonetype
111210,Vice-presidente da república,,"the JSON object must be str, bytes or bytearray, not NoneType",json object must str byte bytearray nonetype
111215,Ministro de estado,,"the JSON object must be str, bytes or bytearray, not NoneType",json object must str byte bytearray nonetype
111220,Secretário - executivo,,"the JSON object must be str, bytes or bytearray, not NoneType",json object must str byte bytearray nonetype
111225,Membro superior do poder executivo,,"the JSON object must be str, bytes or bytearray, not NoneType",json object must str byte bytearray nonetype
111230,Governador de estado,,"the JSON object must be str, bytes or bytearray, not NoneType",json object must str byte bytearray nonetype
111235,Governador do distrito federal,,"the JSON object must be str, bytes or bytearray, not NoneType",json object must str byte bytearray nonetype
111240,Vice-governador de estado,,"the JSON object must be str, bytes or bytearray, not NoneType",json object must str byte bytearray nonetype
111245,Vice-governador do distrito federal,,"the JSON object must be str, bytes or bytearray, not NoneType",json object must str byte bytearray nonetype
111250,Prefeito,,"the JSON object must be str, bytes or bytearray, not NoneType",json object must str byte bytearray nonetype
111255,Vice-prefeito,,"the JSON object must be str, bytes or bytearray, not NoneType",json object must str byte bytearray nonetype
111305,Ministro do supremo tribunal federal,,"the JSON object must be str, bytes or bytearray, not NoneType",json object must str byte bytearray nonetype
111310,Ministro do superior tribunal de justiça,,"the JSON object must be str, bytes or bytearray, not NoneType",json object must str byte bytearray nonetype
111315,Ministro do  superior tribunal militar,,"the JSON object must be str, bytes or bytearray, not NoneType",json object must str byte bytearray nonetype
111320,Ministro do  superior tribunal do trabalho,"Juiz do tribunal regional do trabalho, Juiz federal  de segunda  instância","Judge of the Regional Labor Court, federal judge of second instance",judge regional labor court federal judge second instance
111325,Juiz de direito,"Desembargadores, Juiz de alçada, Juiz de direito de primeira instância","Judges, Judge, Judge of First Instance",judge judge judge first instance
111330,Juiz federal,Juiz do tribunal regional federal,Judge of the Federal Regional Court,judge federal regional court
111335,Juiz auditor federal - justiça militar,,"the JSON object must be str, bytes or bytearray, not NoneType",json object must str byte bytearray nonetype
111340,Juiz auditor estadual - justiça militar,Juiz dos tribunais militares estaduais,Judge of State Military Courts,judge state military court
111345,Juiz do trabalho,,"the JSON object must be str, bytes or bytearray, not NoneType",json object must str byte bytearray nonetype
111405,Dirigente do serviço público federal,"Conselheiro (diplomacia), Coordenador  do serviço público federal, Coordenador geral do serviço público federal, Diretor do serviço público federal, Funcionário público federal superior, Gerente do serviço público federal, Ministro (diplomacia), Secretário de estado (serviço público federal), Secretário (diplomacia), Subsecretário de estado (serviço público federal)","Counselor (Diplomacy), Federal Public Service Coordinator, General Coordinator of the Federal Public Service, Director of the Federal Public Service, Federal Public Officer, Federal Public Service Manager, Minister (Diplomacy), Secretary of State (Federal Public Service), Secretary(diplomacy), Under -Secretary of State (Federal Public Service)",counselor diplomacy federal public service coordinator general coordinator federal public service director federal public service federal public officer federal public service manager minister diplomacy secretary state federal public service secretarydiplomacy secretary state federal public service
111410,Dirigente do serviço público estadual e distrital,"Chefe do serviço público estadual e distrital, Coordenador do serviço público estadual e distrital, Funcionário público estadual e distrital superior, Gerente do serviço público estadual e distrital, Secretário estadual e distrital (serviço público estadual e distrital)","Head of the State and District Public Service, Coordinator of the State and District Public Service, State Public Officer and Higher District, State and District Public Service Manager, State and District Secretary (State and District Public Service)",head state district public service coordinator state district public service state public officer higher district state district public service manager state district secretary state district public service
111415,Dirigente do serviço público municipal,"Chefe de assessoria técnica do serviço público municipal, Chefe de gabinete do serviço público municipal, Diretor de departamento do  serviço público municipal, Diretor de divisão do serviço público municipal, Funcionário público municipal superior, Secretário municipal (serviço público municipal)","Head of Technical Advisory of the Municipal Public Service, Chief of Staff of the Municipal Public Service, Director of Department of the Municipal Public Service, Director of Division of the Municipal Public Service, Municipal Public Officer, Municipal Secretary (Municipal Public Service)",head technical advisory municipal public service chief staff municipal public service director department municipal public service director division municipal public service municipal public officer municipal secretary municipal public service
111505,Especialista de políticas públicas e gestão governamental - eppgg,,"the JSON object must be str, bytes or bytearray, not NoneType",json object must str byte bytearray nonetype
111510,Analista de planejamento e orçamento - apo,,"the JSON object must be str, bytes or bytearray, not NoneType",json object must str byte bytearray nonetype
113005,Cacique,"Morubixaba, Tuxaua","Morubixaba, Tuxaua",morubixaba tuxaua
113010,Líder de comunidade caiçara,,"the JSON object must be str, bytes or bytearray, not NoneType",json object must str byte bytearray nonetype
113015,Membro de liderança quilombola,"Coordenador de associação quilombola, Líder quilombola","Quilombola Association Coordinator, Quilombola leader",quilombola association coordinator quilombola leader
114105,Dirigente de partido político,"Assessor político partidário, Assessr, Dirigente partidário, Dirigente político, Líder partidário","Party Political Advisor, Assessr, Party leader, political leader, party leader",party political advisor assessr party leader political leader party leader
114205,Dirigente de entidade de trabalhadores,"Assistente sindical de entidades de trabalhadores, Diretor de sindicato de trabalhadores","Union Assistant of Workers Entities, Director of Workers Union",union assistant worker entity director worker union
114210,Dirigente de entidade patronal,"Assistente sindical de entidades patronais, Diretor de sindicato patronal","Union assistant of employer entities, director of employer union",union assistant employer entity director employer union
114305,Dirigente e administrador de organização religiosa,"Coordenador de entidade religiosa, Diretor de entidade religiosa, Gestor de entidade religiosa, Secretário-executivo de entidade religiosa","Coordinator of religious entity, director of religious entity, manager of religious entity, executive secretary of religious entity",coordinator religious entity director religious entity manager religious entity executive secretary religious entity
114405,Dirigente e administrador de organização da sociedade civil sem fins lucrativos,"Dirigente de clube e associação esportiva, Dirigente de organização de defesa de direitos, Dirigente de organização de desenvolvimento cultural, Dirigente de organização de proteção ao meio ambiente, Dirigente de organização filantrópica, Dirigente de organização humanitária, Dirigente de organização não-governamental","Club leader and sports association, leader of the defense of rights, leader of cultural development organization, leader of environmental protection organization, leader of philanthropic organization, leader of humanitarian organization, leader of non-governmental organization",club leader sport association leader defense right leader cultural development organization leader environmental protection organization leader philanthropic organization leader humanitarian organization leader nongovernmental organization
121005,Diretor de planejamento estratégico,,"the JSON object must be str, bytes or bytearray, not NoneType",json object must str byte bytearray nonetype
121010,Diretor geral de empresa e organizações (exceto de interesse público),,"the JSON object must be str, bytes or bytearray, not NoneType",json object must str byte bytearray nonetype
122105,Diretor de produção e operações em empresa agropecuária,Diretor de produção na agropecuária,Production Director at Agriculture,production director agriculture
122110,Diretor de produção e operações em empresa aqüícola,,"the JSON object must be str, bytes or bytearray, not NoneType",json object must str byte bytearray nonetype
122115,Diretor de produção e operações em empresa florestal,Diretor de produção em empresa florestal,Production Director in Forest Company,production director forest company
122120,Diretor de produção e operações em empresa pesqueira,Diretor de produção em empresa pesqueira,Production Director in Pesqueira Company,production director pesqueira company
122205,"Diretor de produção e operações da indústria de transformação, extração mineral e utilidades","Diretor de produção em utilidades, Diretor de produção na indústria de transformação, Diretor de produção na mineração, Superintendente de operações industriais","Director of Production in Utilities, Production Director in the Transformation Industry, Production Director in Mining, Superintendent of Industrial Operations",director production utility production director transformation industry production director mining superintendent industrial operation
122305,Diretor de operações de obras pública e civil,"Diretor de contratos de obras pública e civil, Diretor de obras pública e civil, Diretor de produção de obras pública e civil, Superintendente de contratos de operações de obras pública e civil","Director of Public and Civil Works Contracts, Director of Public and Civil Works, Director of Production of Public and Civil Works, Superintendent of Public and Civil Works Operations Contracts",director public civil work contract director public civil work director production public civil work superintendent public civil work operation contract
122405,Diretor de operações comerciais (comércio atacadista e varejista),,"the JSON object must be str, bytes or bytearray, not NoneType",json object must str byte bytearray nonetype
122505,Diretor de  produção e operações de alimentação,,"the JSON object must be str, bytes or bytearray, not NoneType",json object must str byte bytearray nonetype
122510,Diretor de  produção e operações de hotel,,"the JSON object must be str, bytes or bytearray, not NoneType",json object must str byte bytearray nonetype
122515,Diretor de  produção e operações de turismo,,"the JSON object must be str, bytes or bytearray, not NoneType",json object must str byte bytearray nonetype
122520,Turismólogo,"Analista de turismo (turismólogo), Consultor em turismo (turismólogo), Gestor em turismo (turismólogo), Planejador de turismo (turismólogo)","Tourism Analyst (Turismologist), Tourism Consultant (Turismologist), Tourism Manager (Turismologist), Tourism Planner (Turismologist)",tourism analyst turismologist tourism consultant turismologist tourism manager turismologist tourism planner turismologist
122605,Diretor de operações de correios,"Coordenador geral de operações de correios, Diretor de correios","General Coordinator of Post Operations, Post Office Director",general coordinator post operation post office director
122610,Diretor de operações de serviços de armazenamento,"Diretor de gestão portuária, Gerente de terminal em operações de armazenamento","Port Management Director, Terminal Manager in Storage Operations",port management director terminal manager storage operation
122615,Diretor de operações de serviços de telecomunicações,"Diretor de operações de radiodifusão, Diretor de redes (telecomunicações), Diretor regional (telecomunicações)","Director of Broadcasting Operations, Director of Network (Telecommunications), Regional Director (Telecommunications)",director broadcasting operation director network telecommunication regional director telecommunication
122620,Diretor de operações de serviços de transporte,Diretor de logística em operações de transportes,Director of Logistics in Transport Operations,director logistics transport operation
122705,Diretor comercial em operações de intermediação financeira,"Diretor adjunto comercial em operações de intermediação financeira, Diretor de plataforma em operações de intermediação financeira, Diretor regional em operações de intermediação financeira","Assistant Commercial Director in Financial Intermediation Operations, Platform Director in Financial Intermediation Operations, Regional Director in Financial Intermediation Operations",assistant commercial director financial intermediation operation platform director financial intermediation operation regional director financial intermediation operation
122710,Diretor de produtos bancários,,"the JSON object must be str, bytes or bytearray, not NoneType",json object must str byte bytearray nonetype
122715,Diretor de crédito rural,,"the JSON object must be str, bytes or bytearray, not NoneType",json object must str byte bytearray nonetype
122720,Diretor de câmbio e comércio exterior,,"the JSON object must be str, bytes or bytearray, not NoneType",json object must str byte bytearray nonetype
122725,Diretor de compliance,,"the JSON object must be str, bytes or bytearray, not NoneType",json object must str byte bytearray nonetype
122730,Diretor de crédito (exceto crédito imobiliário),,"the JSON object must be str, bytes or bytearray, not NoneType",json object must str byte bytearray nonetype
122735,Diretor de crédito imobiliário,,"the JSON object must be str, bytes or bytearray, not NoneType",json object must str byte bytearray nonetype
122740,Diretor de leasing,,"the JSON object must be str, bytes or bytearray, not NoneType",json object must str byte bytearray nonetype
122745,Diretor de mercado de capitais,,"the JSON object must be str, bytes or bytearray, not NoneType",json object must str byte bytearray nonetype
122750,Diretor de recuperação de créditos em operações de intermediação financeira,,"the JSON object must be str, bytes or bytearray, not NoneType",json object must str byte bytearray nonetype
122755,Diretor de riscos de mercado,,"the JSON object must be str, bytes or bytearray, not NoneType",json object must str byte bytearray nonetype
123105,Diretor administrativo,Superintendente administrativo,Administrative superintendent,administrative superintendent
123110,Diretor administrativo e financeiro,Superintendente administrativo e financeiro,Administrative and Financial Superintendent,administrative financial superintendent
123115,Diretor financeiro,"Diretor de finanças, Diretor de planejamento financeiro, Superintendente de finanças, Superintendente financeiro","Finance Director, Financial Planning Director, Finance Superintendent, Financial Superintendent",finance director financial planning director finance superintendent financial superintendent
123205,Diretor de recursos humanos,Diretor de capital humano,Human capital director,human capital director
123210,Diretor de relações de trabalho,,"the JSON object must be str, bytes or bytearray, not NoneType",json object must str byte bytearray nonetype
123305,Diretor comercial,"Diretor de vendas, Diretor geral de vendas, Superintendente comercial, Vice-presidente comercial, Vice-presidente de vendas","Sales Director, Director General of Sales, Commercial Superintendent, Commercial Vice President, Vice President of Sales",sale director director general sale commercial superintendent commercial vice president vice president sale
123310,Diretor de marketing,"Superintendente de marketing, Vice-presidente de marketing","Marketing Superintendent, Vice President of Marketing",marketing superintendent vice president marketing
123405,Diretor de suprimentos,"Diretor de compras, Diretor de logística e de suprimentos","Purchasing Director, Director of Logistics and Supplies",purchasing director director logistics supply
123410,Diretor de suprimentos no serviço público,,"the JSON object must be str, bytes or bytearray, not NoneType",json object must str byte bytearray nonetype
123605,Diretor de tecnologia da informação,"Diretor de informática, Diretor de infraestrutura de tecnologia da informação, Diretor de processos de tecnologia da informação, Diretor de serviços de informática, Diretor de serviços de tecnologia da informação, Diretor de tecnologia","Director of Computer Science, Director of Information Technology Infrastructure, Director of Information Technology Processes, Director of Computer Services, Director of Information Technology Services, Technology Director",director computer science director information technology infrastructure director information technology process director computer service director information technology service technology director
123705,Diretor de pesquisa e desenvolvimento (p&d),"Diretor de tecnologia (pesquisa e desenvolvimento), Diretor técnico (pesquisa e desenvolvimento), Superintendente de desenvolvimento de produtos e processos","Technology Director (Research and Development), Technical Director (Research and Development), Product and Process Development Superintendent",technology director research development technical director research development product process development superintendent
123805,Diretor de manutenção,"Diretor de operações e manutenção, Superintendente de manutenção","Director of Operations and Maintenance, Maintenance Superintendent",director operation maintenance maintenance superintendent
